{
  "schema": "ADworkflo.execution_plan.v2",
  "configured": false,
  "mvp_id": "unconfigured",
  "source_docs": ["ARCH.md", "TODO.md"],
  "worker_policy": {
    "max_parallel_workers": 1,
    "batching_rule": "dependencies-and-capacity",
    "handoff_outputs": ["worker_state.json", "verification_result.json"]
  },
  "batches": [],
  "integration_tasks": [],
  "open_questions": []
}
